VR Charging Station for Oculus/Meta Quest 2. Charging Dock Stand Set with 2 Rechargeable Batteries(Support Elite Strap). Magnetic Charging Headset and Touch Charging Controller. USB-C Charger Cable,$39.99,https://m.media-amazon.com/images/I/61dUfAbaZHL._AC_UY218_.jpg
MightySkins Skin Compatible with Oculus Quest 2 - Cotton Candy | Protective. Durable. and Unique Vinyl Decal wrap Cover | Easy to Apply. Remove. and Change Styles | Made in The USA. OCQU2-Cotton Candy,$19.99,https://m.media-amazon.com/images/I/51AWFj+bwJL._AC_UY218_.jpg
VRPark Original Right Hand Controller for Oculus Quest 2,$115.01,https://m.media-amazon.com/images/I/41dyPibiDdL._AC_UY218_.jpg
DPVR E4 VR Headsets. PCVR Headset with Controller. 3664x1920 Res. 116° FOV. 120Hz Refresh Rate. Inside-Out 6 DoF Tracking. 280g Light Weight. Virtual Reality Headset for PC. Support SteamVR Games,$599.99,https://m.media-amazon.com/images/I/419ZMgc9qKL._AC_UY218_.jpg
SUPERUS Facial Interface & Face Cover Pad for Oculus Quest 2. Sweat-Proof PU Foam Cushion - VR Accessories for Meta Quest 2. Compatible with Oculus Quest 2 Original Spacer,$16.99,https://m.media-amazon.com/images/I/6150sFk5WbL._AC_UY218_.jpg
TechKen Charging Dock for Oculus Meta Quest 2. Enhanced Magnetic Charging Station with Rechargeable Batteries Pack for Quest 2 Grips [LED Indicate] [Support Elite Strap with Battery],$39.97,https://m.media-amazon.com/images/I/61zW3WXSfhL._AC_UY218_.jpg
AMZDM Controller Grip for Oculus Meta Quest 2 Accessories Grips Cover for VR Touch Controllers Covers Protector with Non-Slip Joystick Covers 1Pair,$12.99,https://m.media-amazon.com/images/I/61CH1OHXGZL._AC_UY218_.jpg
3D VR Virtual Reality Headset Goggle with Remote Controller. VR Glasses for 3D Movies Video Play Games. VR Set for iOS Android Phone for iPhone 13 12 11 Pro Mini X R S Max Samsung Galaxy,$139.98,https://m.media-amazon.com/images/I/51y55zGJ3RL._AC_UY218_.jpg
XREAL Air AR Glasses. Smart Glasses with Massive 201" Micro-OLED Virtual Theater. Augmented Reality Glasses. Watch. Stream. and Game on PC/Android/iOS–Consoles & Cloud Gaming Compatible,$379.00,https://m.media-amazon.com/images/I/51Ntg5cIQOL._AC_UY218_.jpg
DESTEK QH2 Adjustable Battery Pack Head Strap with Retractable Headphones for Meta/Oculus Quest 2. 7000mAh for Gaming Immersion VR Accessories. Replacement for Elite Strap,$47.99,https://m.media-amazon.com/images/I/61GoQeQZzAL._AC_UY218_.jpg
ZYBER Handle Attachments for Oculus Quest 2 Controller Accessories. VR Gorilla Tag Long Arms Grips for Meta Quest 2 Beat Saber Golf Club Baseball. Enhance VR Game Experience,$19.87,https://m.media-amazon.com/images/I/51TtvjDDVyL._AC_UY218_.jpg
PECOOVR Charging Dock for Oculus Quest 2 (Support Elite Strap with Battery). VR Charging Stand for Meta Quest 2. Headset Holder and Controller Magnetic Charging Station with Rechargeable Batteries,$49.99,https://m.media-amazon.com/images/I/61tTzbto9vL._AC_UY218_.jpg
Syntech Link Cable 16 FT Compatible with Quest2/Pico 4 Accessories and PC/Steam VR. High Speed PC Data Transfer. USB 3.0 to USB C Cable for VR Headset,$19.99,https://m.media-amazon.com/images/I/71nuAk1xb6S._AC_UY218_.jpg
3D VR Virtual Reality Headset. VR Glasses Goggles w/Bluetooth Headphone [Newest] for iPhone 12 11 Pro Max Mini X R S 8 7 Samsung Galaxy S10 S9 S8 S7 Edge Note/A 10 9 8 + etc 4.7-6.2" Cellphone. White,$129.98,https://m.media-amazon.com/images/I/61vwOEh4zkL._AC_UY218_.jpg
SARLAR Design Hard Carrying Case for Oculus Quest 2/ Elite Strap Edition/Quest Lightweight and Portable Protection. Custom Travel Case Storage VR Gaming Headset and Touch Controller Accessories,$29.99,https://m.media-amazon.com/images/I/61lwG12lr4L._AC_UY218_.jpg
Cuddoth Charging Dock for Oculus Quest 2 & Meta Quest 2 - Magnetic Docking Station with 2 Rechargeable Batteries. USB-C Charging Cable. and Handle Cover for Headset and Controllers,$39.99,https://m.media-amazon.com/images/I/61uDwolhI6L._AC_UY218_.jpg
TechKen VR Facial Interface and Foam Replacement Set for Oculus Meta Quest 2 | Removable Facial Interface Frame & Foam Face Covers Replacement & Anti-Leakage Nose Pad & Lens Cover,$16.97,https://m.media-amazon.com/images/I/61yizwTDvBL._AC_UY218_.jpg
Ergonomic Office Chair with Adjustable Lumbar Support. High-Back Mesh Desk Chair with Sliding Seat. 2D Armrest - Swivel Computer Task Chair for Home,$189.00,https://m.media-amazon.com/images/I/91kFBuuktFL._AC_UL320_.jpg
Amazon Basics Tall Kitchen Drawstring Trash Bags. 13 Gallon. Unscented. 120 Count (Previously Solimo),$18.61,https://m.media-amazon.com/images/I/71D7tbndeLL._AC_UL320_.jpg
Amazon Basics 2-Ply Toilet Paper. Unscented. 30 Count (5 Packs of 6). White (Previously Solimo),$26.29,https://m.media-amazon.com/images/I/611BMkwsBsL._AC_UL320_.jpg
Amazon Basics 20-Pack AAA Alkaline High-Performance Batteries. 1.5 Volt. 10-Year Shelf Life,$8.76,https://m.media-amazon.com/images/I/71a+E3+Bc2L._AC_UL320_.jpg
Amazon Basics Daily Moisturizing Lotion. 12 Fluid Ounces. 1-Pack,$10.46,https://m.media-amazon.com/images/I/51-FyI+x+dL._AC_UL320_.jpg
Amazon Basics Multipurpose Copy Printer Paper. 8.5 x 11 Inch 20Lb Paper - 8 Ream Case (4.000 Sheets). 92 GE Bright White,$39.99,https://m.media-amazon.com/images/I/71yKhJpWLnS._AC_UL320_.jpg
Amazon Basics 20-Pack AA Alkaline Batteries. 1.5 Volt. Long-Lasting Power,$9.34,https://m.media-amazon.com/images/I/81mInjo0NxL._AC_UL320_.jpg
Amazon Basics Glass Food Storage Container with BPA-Free Locking Lid - Set of 14,$20.91,https://m.media-amazon.com/images/I/81zTSQb7j9L._AC_UL320_.jpg
Amazon Basics-Everyday Paper Plates. 8.5" 200 Count,$16.21,https://m.media-amazon.com/images/I/71sBVdzHm-L._AC_UL320_.jpg
Amazon Basics Non-Scratch Sponges. 6-Pack. Blue,$4.18,https://m.media-amazon.com/images/I/81mT+RDBWZL._AC_UL320_.jpg
Amazon Basics 5-Blade MotionSphere Razor for Men with Dual Lubrication and Precision Trimmer. Handle & 16 Cartridges. Cartridges fit Amazon Basics Razor Handles only. 17 Piece Set. Black,$22.99,https://m.media-amazon.com/images/I/81iq2d4qY7L._AC_UL320_.jpg
Amazon Basics 2-Ply Paper Towels. Flex-Sheets. 6 Rolls (Pack of 2). 12 Value Rolls total (Previously Solimo),$24.99,https://m.media-amazon.com/images/I/61POocZniqL._AC_UL320_.jpg
Amazon Essentials Women's Classic-Fit Short-Sleeve V-Neck T-Shirt. (Available in Plus Size). Multipacks,$15.92,https://m.media-amazon.com/images/I/61VXOrqsTyS._AC_UL320_.jpg
Amazon Basics 3 Speed Small Room Air Circulator Fan. 7-Inch Blade. Black,$17.99,https://m.media-amazon.com/images/I/81U06MS2NiL._AC_UL320_.jpg
Amazon Basics Clean Plus Toothbrushes. Soft. Full. 10 Count. 1 Pack (Previously Solimo),$5.18,https://m.media-amazon.com/images/I/718r9jEAzqL._AC_UL320_.jpg
Amazon Basics 6-Outlet Surge Protector Power Strip. 2 USB Ports. 2 Ft Cord - 500 Joule. Black. 2-Pack,$18.54,https://m.media-amazon.com/images/I/714TvOGvVwL._AC_UL320_.jpg
Amazon Basics 5-Shelf Adjustable. Heavy Duty Storage Shelving Unit (350 lbs loading capacity per shelf). Steel Organizer Wire Rack. Black (36L x 14W x 72H),$72.88,https://m.media-amazon.com/images/I/716vdWfenAL._AC_UL320_.jpg
Charmin Ultra Strong Clean Touch Toilet Paper. 18 Family Mega Rolls = 90 Regular Rolls,$28.40,https://m.media-amazon.com/images/I/61kd3BuEN+L._AC_UL320_.jpg
Digital Kitchen Scale. DEMALO 22lbs 5 Units Food Scale Weight Grams and Ounces with Tare Function. Large Panel Digital Scale with LCD Display. 1g/0.1oz Precise Graduation Scale for Baking. Cooking,$14.99,https://m.media-amazon.com/images/I/71oYozi7UfL._AC_UL320_.jpg
Over The Door Shoe Organizers 35 Durable Mesh Pockets Hanging Shoe Organizer Shoe Rack For Closet Entryway Bedroom Bathroom Pantry Shoe Holder. Men Sneakers. Women High Heeled Shoes. Flip Flops Black,$19.99,https://m.media-amazon.com/images/I/91ECWxUm9JL._AC_UL320_.jpg
Trace Minerals | Liquid Vitamin D3 | 126mcg (5000 IU) D3 with 72+ Concentrace Ionic Trace Minerals | Fast Absorbing. High Potency | Natural Tropical Cherry Flavor | 32 Servings. 16 fl oz,$22.99,https://m.media-amazon.com/images/I/61XLYj6z9iL._AC_UL320_.jpg
Amazon Basics Multipurpose Drawstring Trash Bags. Unscented. 30 Gallon. 50 Count (Previously Solimo),$13.65,https://m.media-amazon.com/images/I/61kb6bblLhL._AC_UL320_.jpg
Amazon Basics Freezer Gallon Bags. 90 Count (Previously Solimo),$9.69,https://m.media-amazon.com/images/I/71lX-GOpEoL._AC_UL320_.jpg
Amazon Basics Multipurpose Exfoliating Dermaplaning Tool. Eyebrow Razor. and Facial Razor. Includes Blade Cover. Multicolor. 3 Count,$4.17,https://m.media-amazon.com/images/I/61PiUWG8M7L._AC_UL320_.jpg
Amazon Basics Women's 5 Blade FITS Razor for Women. FITS and Venus Handles. Includes 1 FITS Handle. 12 Cartridges & 1 Shower Hanger,$17.43,https://m.media-amazon.com/images/I/61Kwa4j8g+L._AC_UL320_.jpg
iPhone Charger Lightning Cable.2 Pack Apple MFi Certified USB iPhone Fast Chargering Cord.Data Sync Transfer for 13/12/11 Pro Max Xs X XR 8 7 6 5 5s iPad iPod More Model Cell Phone Cables,$6.99,https://m.media-amazon.com/images/I/610-S24E0qL._AC_UL320_.jpg
Charmin Ultra Soft Cushiony Touch Toilet Paper. 24 Family Mega Rolls = 123 Regular Rolls,$34.98,https://m.media-amazon.com/images/I/71eDXyci6zL._AC_UL320_.jpg
Superior Source Vitamin D3 5000 IU. Under The Tongue Quick Dissolve Sublingual Tablets. 100 Count. Promotes Strong Bones and Teeth. Immune Support. Non-GMO,$11.33,https://m.media-amazon.com/images/I/61Xifi-caFL._AC_UL320_.jpg
128GB USB 3.1 3.0 Flash Drive Bulk 2 Pack Multipack Bundle with Lanyard R:130MB/s W:60MB/s 128 GB 128G 128 G Thumb Drive Set w/Led Light Memory Stick Zip Drive Jump Drive Pen Drive (2-Pack),$13.99,https://m.media-amazon.com/images/I/71OpinKGXYL._AC_UL320_.jpg
Amazon Basics Felt Tip Marker Pens - Assorted Color. 12-Pack,$6.75,https://m.media-amazon.com/images/I/91Xdv3MUWnL._AC_UL320_.jpg
Amazon Basics Lightweight Super Soft Easy Care Microfiber Bed Sheet Set with 14-Inch Deep Pockets - Queen. Light Gray,$28.01,https://m.media-amazon.com/images/I/612qrLEk44L._AC_UL320_.jpg
Amazon Basics Euro Bar Cabinet Handle (1/2-inch Diameter). 8.69-inch Length (6.31-inch Hole Center). Oil Rubbed Bronze. 10-Pack,$24.25,https://m.media-amazon.com/images/I/61QhIY9bncL._AC_UL320_.jpg
Amazon Basics Clarifying Pink Grapefruit Body Wash. 2% Salicylic Acid Acne Treatment. Dermatologist Tested. 8.5 Fluid Ounces. Pack of 1,$4.92,https://m.media-amazon.com/images/I/61fdWp44IgL._AC_UL320_.jpg
Amazon Basics Multipurpose. Comfort Grip. PVD coated. Stainless Steel Office Scissors - Pack of 3,$8.65,https://m.media-amazon.com/images/I/61Kt+fEtyRL._AC_UL320_.jpg
Amazon Basics Microfiber Cleaning Cloths. Non-Abrasive. Reusable and Washable - Pack of 24. 12 x16-Inch. Blue. White and Yellow,$13.28,https://m.media-amazon.com/images/I/81wUWVAiWDL._AC_UL320_.jpg
Broom and Dustpan Comb Set for Home Super Long Handle.Upright Standing Dustpan for Home Room Kitchen Office Lobby Outdoor Floor Use(Gray & Orange),$23.99,https://m.media-amazon.com/images/I/61zELlfqTPL._AC_UL320_.jpg
Queen Size Sheet Set - Breathable & Cooling Sheets - Hotel Luxury Bed Sheets - Extra Soft - Deep Pockets - Easy Fit - 4 Piece Set - Wrinkle Free - Comfy – Beige Tan Bed Sheets - Queens Sheets – 4 PC,$25.49,https://m.media-amazon.com/images/I/61ZQkmlccWL._AC_UL320_.jpg
POWEROWL High-Capacity Alkaline AA Batteries 24 Pack. 1.5v Long Lasting Double A Battery. 10-Year Shelf Life,$14.99,https://m.media-amazon.com/images/I/71x2WnmXiaL._AC_UL320_.jpg
Amazon Basics Underwear Dresser Drawer Organizers. Pack of 2,$7.47,https://m.media-amazon.com/images/I/91HREYNRWQL._AC_UL320_.jpg
Amazon Basics Mint Dental Flossers. 90 Count. 1 Pack (Previously Solimo),$2.97,https://m.media-amazon.com/images/I/61Lu42O2+ML._AC_UL320_.jpg
Amazon Basics 36-Pack AA Alkaline High-Performance Batteries. 1.5 Volt. 10-Year Shelf Life,$15.78,https://m.media-amazon.com/images/I/81tQBi634XL._AC_UL320_.jpg
Amazon Basics 6-Outlet Surge Protector Power Strip. 6-Foot Long Cord. 790 Joule - White,$6.16,https://m.media-amazon.com/images/I/71-N0PxSwJL._AC_UL320_.jpg
Amazon Basics-Everyday Paper Plates. 10" 50 Count,$8.82,https://m.media-amazon.com/images/I/61BtVinY81L._AC_UL320_.jpg
Amazon Basics USB-A to Lightning Charger Cable. Nylon Braided Cord. MFi Certified Charger for Apple iPhone 14 13 12 11 X Xs Pro. Pro Max. Plus. iPad. 3 Foot. Dark Gray,$9.99,https://m.media-amazon.com/images/I/51bL094WehL._AC_UL320_.jpg
Amazon Basics Replacement Water Filters for Water Pitchers. Compatible with Brita - 3-Pack,$12.49,https://m.media-amazon.com/images/I/51gPRggQhPL._AC_UL320_.jpg
Amazon Basics 10 Day Teeth Whitening Strips Kit. 10 Treatments. 1-Pack (Previously Solimo),Null,https://m.media-amazon.com/images/I/71hLJv0GDdL._AC_UL320_.jpg
Amazon Basics Tall Kitchen Drawstring Trash Bags. 13 Gallon. Unscented. 200 Count (Previously Solimo),$24.51,https://m.media-amazon.com/images/I/71yLbfmPRoL._AC_UL320_.jpg
Outlet Extender with Night Light. Multi Plug Outlet. USB Wall Charger Surge Protector 4 USB Charging Port(1USB C). Power Strip Electrical Outlet Splitter Expander for Home Office Dorm Room ETL Listed,$16.97,https://m.media-amazon.com/images/I/51IN2UzjteL._AC_UL320_.jpg
Amazon Basics Liquid Hand Soap Refill. Mango and Coconut Water Scent. Triclosan-Free. 56 Fluid Ounces. 1-Pack (Previously Solimo),$4.57,https://m.media-amazon.com/images/I/61uF3buxerL._AC_UL320_.jpg
Amazon Basics Dry Floor Mop Pads. 36 Count (Previously Solimo),$12.47,https://m.media-amazon.com/images/I/712kEi5-wEL._AC_UL320_.jpg
Amazon Basics Daily Pantiliner. Extra Long Length. Unscented. 68 Count. 1 Pack (Previously Solimo),$4.95,https://m.media-amazon.com/images/I/61dkcWXXIvL._AC_UL320_.jpg
Amazon Basics Cotton Swabs. 500 Count (Previously Solimo),$3.19,https://m.media-amazon.com/images/I/61viR94S9QL._AC_UL320_.jpg
Amazon Basics Broom Holder Wall Mount and Garden Tool Organizer. 6 Hook. Gray,$11.39,https://m.media-amazon.com/images/I/71oRRYmb4mS._AC_UL320_.jpg
Amazon Basics Snack Storage Bags. 300 Count (Previously Solimo),$6.84,https://m.media-amazon.com/images/I/617ZXAE3teL._AC_UL320_.jpg
Amazon Basics Stainless Steel Digital Kitchen Scale with LCD Display. Batteries Included,$11.39,https://m.media-amazon.com/images/I/71mcRfq5GsL._AC_UL320_.jpg
Amazon Basics Slim. Velvet. Non-Slip Suit Clothes Hangers. Black/Silver - Pack of 50,$19.19,https://m.media-amazon.com/images/I/81Cn1+lUraL._AC_UL320_.jpg
Amazon Basics Epsom Salt Soaking Aid. Lavender Scented. 3 Pound. 1-Pack (Previously Solimo),$4.99,https://m.media-amazon.com/images/I/61aXZxT1v8L._AC_UL320_.jpg
Amazon Basics Heavy Duty Aluminum Foil. 125 Sq Ft (Pack of 1),$8.91,https://m.media-amazon.com/images/I/61CThGyDRaL._AC_UL320_.jpg
Amazon Basics Moldable Sensory Play Sand with Castle Molds and Tool Set. for Kids Ages 3 and Up. Natural Brown Color,$5.70,https://m.media-amazon.com/images/I/81gF+J+anaL._AC_UL320_.jpg
Amazon Basics Heavy Duty Mop Pads. 30 Count,$15.02,https://m.media-amazon.com/images/I/51RH+4kkzvL._AC_UL320_.jpg
Amazon Basics Electric Glass and Steel Hot Tea Water Kettle. 1.7-Liter,$27.99,https://m.media-amazon.com/images/I/812C5q3i5+L._AC_UL320_.jpg
Amazon Basics Lightweight Super Soft Easy Care Microfiber Bed Sheet Set with 14-Inch Deep Pockets - Queen. Dark Gray,$28.01,https://m.media-amazon.com/images/I/81RY+mU4+fL._AC_UL320_.jpg
6 Pack Clothes Storage. Foldable Blanket Storage Bags. Storage Containers for Organizing Bedroom. Closet. Clothing. Comforter. Organization and Storage with Lids and Handle. Grey,$29.99,https://m.media-amazon.com/images/I/71MQDqctnOL._AC_UL320_.jpg
